{
  "$schema": "https://json-schema.org/draft/2020-12/schema",
  "$id": "https://gallery.local/schemas/rule-package-v1.json",
  "title": "Gallery Canonical Rule Package v1",
  "type": "object",
  "additionalProperties": false,
  "required": [
    "rule_set_id",
    "version",
    "schema_version",
    "normalization_algorithm_version",
    "compiler_requirement",
    "cel_profile_version",
    "parameter_schema",
    "provider_namespaces",
    "primitives",
    "cel_expressions",
    "tests",
    "extensions"
  ],
  "properties": {
    "rule_set_id": {"type": "string", "pattern": "^rset_[0-9a-f-]{36}$"},
    "version": {"type": "string", "pattern": "^[0-9]+\\.[0-9]+\\.[0-9]+(?:[-+][0-9A-Za-z.-]+)?$"},
    "schema_version": {"const": 1, "default": 1},
    "normalization_algorithm_version": {"const": "gallery-canonical-json-v1", "default": "gallery-canonical-json-v1"},
    "compiler_requirement": {"type": "string", "const": "gallery-rule-compiler-v1", "default": "gallery-rule-compiler-v1"},
    "cel_profile_version": {"const": "gallery-cel-v1", "default": "gallery-cel-v1"},
    "parameter_schema": {"type": "object", "default": {"type": "object", "additionalProperties": false}},
    "provider_namespaces": {
      "type": "array",
      "items": {"type": "string", "minLength": 1, "maxLength": 128},
      "uniqueItems": true,
      "default": []
    },
    "primitives": {
      "type": "array",
      "maxItems": 4096,
      "items": {
        "type": "object",
        "additionalProperties": false,
        "required": ["id", "kind", "config"],
        "properties": {
          "id": {"type": "string", "pattern": "^[A-Za-z][A-Za-z0-9_.-]{0,127}$"},
          "kind": {
            "type": "string",
            "enum": ["path_match", "selector", "fallback", "stable_key", "media_classify", "media_hidden", "media_order", "cover_candidate", "cover_disable_marker", "badge", "work_date", "path_capture", "presentation", "metadata_map", "condition"]
          },
          "config": {"type": "object"}
        }
      },
      "default": []
    },
    "cel_expressions": {
      "type": "array",
      "maxItems": 1024,
      "items": {
        "type": "object",
        "additionalProperties": false,
        "required": ["id", "purpose", "expression"],
        "properties": {
          "id": {"type": "string", "pattern": "^[A-Za-z][A-Za-z0-9_.-]{0,127}$"},
          "purpose": {"type": "string", "enum": ["predicate", "scalar"]},
          "expression": {"type": "string", "maxLength": 4096}
        }
      },
      "default": []
    },
    "tests": {"type": "array", "minItems": 1, "maxItems": 10000},
    "extensions": {
      "type": "object",
      "$comment": "分类 extension 为对象 {required:bool, semantic:bool, version?:string, payload?:any}；required 或 semantic 者必须落在编译器支持的 namespace/version 内，semantic 者参与 semantic_hash。缺少 semantic 字段的遗留 extension 按 optional+nonsemantic 处理，只参与 package_hash。分类语义由编译器强制，本 Schema 保持宽松以兼容既有 RuleVersion。",
      "propertyNames": {"pattern": "^[a-z0-9][a-z0-9-]{0,62}(?:\\.[a-z0-9][a-z0-9-]{0,62})+$"},
      "additionalProperties": true,
      "default": {}
    },
    "ui_metadata": {
      "type": "object",
      "description": "仅供 Schema 表单和编辑器使用的非执行元数据",
      "properties": {
        "title": {"type": "string", "maxLength": 512},
        "description": {"type": "string", "maxLength": 4096},
        "order": {"type": "array", "items": {"type": "string"}, "uniqueItems": true},
        "groups": {
          "type": "object",
          "additionalProperties": {
            "type": "object",
            "properties": {
              "title": {"type": "string"},
              "description": {"type": "string"},
              "order": {"type": "integer"}
            },
            "additionalProperties": true
          }
        },
        "fields": {
          "type": "object",
          "description": "按 JSON Pointer 索引的表单字段元数据",
          "additionalProperties": {
            "type": "object",
            "properties": {
              "title": {"type": "string"},
              "description": {"type": "string"},
              "group": {"type": "string"},
              "order": {"type": "integer"},
              "advanced": {"type": "boolean"},
              "sensitive": {"type": "boolean"},
              "readOnly": {"type": "boolean"},
              "computed": {"type": "boolean"},
              "default": {},
              "enum": {"type": "array"},
              "visibleWhen": {"type": "object", "additionalProperties": true},
              "items": {"type": "object", "additionalProperties": true}
            },
            "additionalProperties": true
          }
        }
      },
      "additionalProperties": true
    },
    "package_hash": {"type": "string", "pattern": "^[0-9a-f]{64}$"},
    "semantic_hash": {"type": "string", "pattern": "^[0-9a-f]{64}$"}
  }
}
