{
  "rule_set_id": "rset_ca0135da-e1e1-49a4-aaaa-9354f5159405",
  "version": "1.0.0",
  "schema_version": 1,
  "normalization_algorithm_version": "gallery-canonical-json-v1",
  "compiler_requirement": "gallery-rule-compiler-v1",
  "cel_profile_version": "gallery-cel-v1",
  "parameter_schema": {"type": "object", "additionalProperties": false},
  "provider_namespaces": ["testlab.patreon-library-bounded"],
  "primitives": [
    {"id": "work", "kind": "path_match", "config": {"scope": "work_directory", "glob": "*", "title": "directory_name", "stable_key": "relative_path", "metadata_file": "metadata.json"}},
    {"id": "title", "kind": "selector", "config": {"target": "title", "pointers": ["/title"], "required": false}},
    {"id": "facts", "kind": "metadata_map", "config": {"fields": {
      "external_id": ["/id"],
      "provider_id": ["/creator/id"],
      "creator": ["/creator/full_name", "/creator/first_name"],
      "description": ["/content"],
      "tags": ["/tags"]
    }}},
    {"id": "url", "kind": "fallback", "config": {"target": "source_url", "pointers": ["/postUrl", "/post_url", "/url", "/sourceUrl", "/source_url", "/permalink", "/link", "/source/url"], "default": ""}},
    {"id": "media-jpg", "kind": "media_classify", "config": {"glob": "*.jpg", "kind": "image", "mime": "image/jpeg"}},
    {"id": "media-jpeg", "kind": "media_classify", "config": {"glob": "*.jpeg", "kind": "image", "mime": "image/jpeg"}},
    {"id": "media-png", "kind": "media_classify", "config": {"glob": "*.png", "kind": "image", "mime": "image/png"}},
    {"id": "media-gif", "kind": "media_classify", "config": {"glob": "*.gif", "kind": "image", "mime": "image/gif"}},
    {"id": "media-webp", "kind": "media_classify", "config": {"glob": "*.webp", "kind": "image", "mime": "image/webp"}},
    {"id": "media-mp4", "kind": "media_classify", "config": {"glob": "*.mp4", "kind": "video", "mime": "video/mp4"}},
    {"id": "media-mov", "kind": "media_classify", "config": {"glob": "*.mov", "kind": "video", "mime": "video/quicktime"}},
    {"id": "media-m4v", "kind": "media_classify", "config": {"glob": "*.m4v", "kind": "video", "mime": "video/mp4"}},
    {"id": "cover", "kind": "cover_candidate", "config": {"glob": "cover.*", "score": 100}},
    {"id": "cover-dot", "kind": "cover_candidate", "config": {"glob": ".cover.*", "score": 100}},
    {"id": "order", "kind": "media_order", "config": {"by": "path", "direction": "asc"}}
  ],
  "cel_expressions": [],
  "tests": [{"id": "testlab-patreon-library-bounded-smoke", "description": "500k/有界真实验证：Patreon 有界子目录场景，creator 回退链 full_name -> first_name，providerId<-creator.id，description<-content"}],
  "extensions": {}
}
