{
  "rule_set_id": "rset_be4f0290-2fd9-4b6d-947c-eb183c4ad602",
  "version": "1.0.0",
  "schema_version": 1,
  "normalization_algorithm_version": "gallery-canonical-json-v1",
  "compiler_requirement": "gallery-rule-compiler-v1",
  "cel_profile_version": "gallery-cel-v1",
  "parameter_schema": {"type": "object", "additionalProperties": false},
  "provider_namespaces": ["testlab.weibo-legacy-library-bounded"],
  "primitives": [
    {"id": "work", "kind": "path_match", "config": {"scope": "work_directory", "glob": "*", "title": "directory_name", "stable_key": "relative_path", "metadata_file": "metadata.json"}},
    {"id": "title", "kind": "selector", "config": {"target": "title", "pointers": ["/date"], "required": false}},
    {"id": "facts", "kind": "metadata_map", "config": {"fields": {
      "external_id": ["/idstr", "/id"],
      "provider_id": ["/user/idstr", "/user/id"],
      "creator": ["/user/screen_name"],
      "description": ["/text_raw", "/text"],
      "tags": ["/tags"]
    }}},
    {"id": "url", "kind": "fallback", "config": {"target": "source_url", "pointers": ["/postUrl", "/post_url", "/url", "/sourceUrl", "/source_url", "/permalink", "/link", "/source/url"]}},
    {"id": "media-jpg", "kind": "media_classify", "config": {"glob": "*.jpg", "kind": "image", "mime": "image/jpeg"}},
    {"id": "media-jpeg", "kind": "media_classify", "config": {"glob": "*.jpeg", "kind": "image", "mime": "image/jpeg"}},
    {"id": "media-png", "kind": "media_classify", "config": {"glob": "*.png", "kind": "image", "mime": "image/png"}},
    {"id": "media-gif", "kind": "media_classify", "config": {"glob": "*.gif", "kind": "image", "mime": "image/gif"}},
    {"id": "media-mp4", "kind": "media_classify", "config": {"glob": "*.mp4", "kind": "video", "mime": "video/mp4"}},
    {"id": "media-webp", "kind": "media_classify", "config": {"glob": "*.webp", "kind": "image", "mime": "image/webp"}},
    {"id": "cover", "kind": "cover_candidate", "config": {"glob": "cover.*", "score": 100}},
    {"id": "cover-dot", "kind": "cover_candidate", "config": {"glob": ".cover.*", "score": 100}},
    {"id": "order", "kind": "media_order", "config": {"by": "path", "direction": "asc"}}
  ],
  "cel_expressions": [],
  "tests": [{"id": "testlab-weibo-legacy-library-bounded-smoke", "description": "500k/有界真实验证：微博_Legacy 有界子目录场景，规则与微博相同但独立 rule_set_id/provider_namespace，作为独立 Source/Binding/真实测试项，不得与微博合并或跳过"}],
  "extensions": {}
}
